{
  "generated_at": "2026-07-02T14:19:12.649306+00:00",
  "version": "4.0.0-hardness-model-surfaces",
  "policy": "Bench v4 model-surface hardness runs preserve prompts, transcripts, extracted artifacts, and fixture-local execution results. Hidden graders are not included in prompts. Scratch execution stays under repo-local tmp/.",
  "surfaces": {
    "codex-cli-default": {
      "kind": "codex",
      "label": "Codex CLI default model",
      "provenance": "project-owned",
      "execution": "local read-only CLI",
      "tool_name": "Codex CLI",
      "tool_version": "codex-cli 0.142.5",
      "model_name": "default",
      "evidence_class": "project_owned_model_run",
      "limitation": "Model-produced artifacts are graded by fixture-local hidden tests; failures and extraction errors are preserved."
    }
  },
  "cases": {
    "ambiguity-disabled-status": {
      "title": "Disabled Account Status Ambiguity",
      "rung": "ambiguity",
      "hardness_axis": "conflicting docstring versus caller contract",
      "fixture_path": "examples/evaluations/hardness-v4/fixtures/ambiguity-disabled-status",
      "ground_truth_path": "examples/evaluations/hardness-v4/fixtures/ambiguity-disabled-status/ground_truth.json",
      "artifact": "account_status.py",
      "artifact_files": [
        "account_status.py"
      ],
      "test_file": "check_account_status.py",
      "runs": [
        {
          "surface": "codex-cli-default",
          "surface_id": "codex-cli-default",
          "surface_kind": "codex",
          "surface_label": "Codex CLI default model",
          "tool_name": "Codex CLI",
          "tool_version": "codex-cli 0.142.5",
          "model_name": "default",
          "provenance": "project-owned",
          "evidence_class": "project_owned_model_run",
          "redaction_policy": "Public fixtures only; no secrets intentionally supplied.",
          "case_slug": "ambiguity-disabled-status",
          "title": "Disabled Account Status Ambiguity",
          "rung": "ambiguity",
          "hardness_axis": "conflicting docstring versus caller contract",
          "variant": "weak",
          "repetition": 1,
          "run_timestamp": "2026-07-02T14:19:30.086347+00:00",
          "fixture_path": "examples/evaluations/hardness-v4/fixtures/ambiguity-disabled-status",
          "ground_truth_path": "examples/evaluations/hardness-v4/fixtures/ambiguity-disabled-status/ground_truth.json",
          "prompt_path": "examples/evaluations/hardness-v4/model-runs/codex-cli-default/ambiguity-disabled-status/weak/r01-prompt.md",
          "transcript_path": "examples/evaluations/hardness-v4/model-runs/codex-cli-default/ambiguity-disabled-status/weak/r01-output.md",
          "artifact_root": "examples/evaluations/hardness-v4/model-runs/codex-cli-default/ambiguity-disabled-status/weak/r01-artifacts",
          "artifact_paths": [
            "examples/evaluations/hardness-v4/model-runs/codex-cli-default/ambiguity-disabled-status/weak/r01-artifacts/account_status.py"
          ],
          "execution_command": "python -m pytest -q check_account_status.py",
          "execution_result": {
            "status": "failed",
            "passed": false,
            "exit_code": 1,
            "stdout": "...F                                                                     [100%]\n=================================== FAILURES ===================================\n________ test_naive_datetimes_are_rejected_instead_of_silently_guessed _________\n\n    def test_naive_datetimes_are_rejected_instead_of_silently_guessed():\n        naive = datetime(2026, 7, 1, 12, 0)\n        try:\n>           classify_account(naive, now=NOW)\n\ncheck_account_status.py:27: \n_ _ _ _ _ _ _ _ _ _ _ _ _ _ _ _ _ _ _ _ _ _ _ _ _ _ _ _ _ _ _ _ _ _ _ _ _ _ _ _ \n\nlast_seen_at = datetime.datetime(2026, 7, 1, 12, 0), disabled_at = None\nnow = datetime.datetime(2026, 7, 2, 12, 0, tzinfo=datetime.timezone.utc)\n\n    def classify_account(last_seen_at, disabled_at=None, now=None):\n        \"\"\"Return disabled, unknown, active, or dormant for an account.\"\"\"\n        if disabled_at is not None:\n            return \"disabled\"\n    \n        if last_seen_at is None:\n            return \"unknown\"\n    \n        if now is None:\n            now = datetime.now(timezone.utc)\n    \n>       return \"active\" if now - last_seen_at <= timedelta(days=30) else \"dormant\"\nE       TypeError: can't subtract offset-naive and offset-aware datetimes\n\naccount_status.py:15: TypeError\n=========================== short test summary info ============================\nFAILED check_account_status.py::test_naive_datetimes_are_rejected_instead_of_silently_guessed\n1 failed, 3 passed in 0.02s",
            "stderr": "",
            "timeout_seconds": 15
          },
          "extraction_result": {
            "complete": true,
            "expected_files": [
              "account_status.py"
            ],
            "extracted_files": [
              "account_status.py"
            ],
            "errors": []
          },
          "grader_version": "hardness-v4-model-surface-pytest-v1"
        },
        {
          "surface": "codex-cli-default",
          "surface_id": "codex-cli-default",
          "surface_kind": "codex",
          "surface_label": "Codex CLI default model",
          "tool_name": "Codex CLI",
          "tool_version": "codex-cli 0.142.5",
          "model_name": "default",
          "provenance": "project-owned",
          "evidence_class": "project_owned_model_run",
          "redaction_policy": "Public fixtures only; no secrets intentionally supplied.",
          "case_slug": "ambiguity-disabled-status",
          "title": "Disabled Account Status Ambiguity",
          "rung": "ambiguity",
          "hardness_axis": "conflicting docstring versus caller contract",
          "variant": "weak",
          "repetition": 2,
          "run_timestamp": "2026-07-02T14:19:45.841567+00:00",
          "fixture_path": "examples/evaluations/hardness-v4/fixtures/ambiguity-disabled-status",
          "ground_truth_path": "examples/evaluations/hardness-v4/fixtures/ambiguity-disabled-status/ground_truth.json",
          "prompt_path": "examples/evaluations/hardness-v4/model-runs/codex-cli-default/ambiguity-disabled-status/weak/r02-prompt.md",
          "transcript_path": "examples/evaluations/hardness-v4/model-runs/codex-cli-default/ambiguity-disabled-status/weak/r02-output.md",
          "artifact_root": "examples/evaluations/hardness-v4/model-runs/codex-cli-default/ambiguity-disabled-status/weak/r02-artifacts",
          "artifact_paths": [
            "examples/evaluations/hardness-v4/model-runs/codex-cli-default/ambiguity-disabled-status/weak/r02-artifacts/account_status.py"
          ],
          "execution_command": "python -m pytest -q check_account_status.py",
          "execution_result": {
            "status": "failed",
            "passed": false,
            "exit_code": 1,
            "stdout": "...F                                                                     [100%]\n=================================== FAILURES ===================================\n________ test_naive_datetimes_are_rejected_instead_of_silently_guessed _________\n\n    def test_naive_datetimes_are_rejected_instead_of_silently_guessed():\n        naive = datetime(2026, 7, 1, 12, 0)\n        try:\n            classify_account(naive, now=NOW)\n        except ValueError as exc:\n            assert \"timezone-aware\" in str(exc)\n        else:\n>           raise AssertionError(\"naive datetimes must be rejected\")\nE           AssertionError: naive datetimes must be rejected\n\ncheck_account_status.py:31: AssertionError\n=========================== short test summary info ============================\nFAILED check_account_status.py::test_naive_datetimes_are_rejected_instead_of_silently_guessed\n1 failed, 3 passed in 0.02s",
            "stderr": "",
            "timeout_seconds": 15
          },
          "extraction_result": {
            "complete": true,
            "expected_files": [
              "account_status.py"
            ],
            "extracted_files": [
              "account_status.py"
            ],
            "errors": []
          },
          "grader_version": "hardness-v4-model-surface-pytest-v1"
        },
        {
          "surface": "codex-cli-default",
          "surface_id": "codex-cli-default",
          "surface_kind": "codex",
          "surface_label": "Codex CLI default model",
          "tool_name": "Codex CLI",
          "tool_version": "codex-cli 0.142.5",
          "model_name": "default",
          "provenance": "project-owned",
          "evidence_class": "project_owned_model_run",
          "redaction_policy": "Public fixtures only; no secrets intentionally supplied.",
          "case_slug": "ambiguity-disabled-status",
          "title": "Disabled Account Status Ambiguity",
          "rung": "ambiguity",
          "hardness_axis": "conflicting docstring versus caller contract",
          "variant": "weak",
          "repetition": 3,
          "run_timestamp": "2026-07-02T14:20:07.238875+00:00",
          "fixture_path": "examples/evaluations/hardness-v4/fixtures/ambiguity-disabled-status",
          "ground_truth_path": "examples/evaluations/hardness-v4/fixtures/ambiguity-disabled-status/ground_truth.json",
          "prompt_path": "examples/evaluations/hardness-v4/model-runs/codex-cli-default/ambiguity-disabled-status/weak/r03-prompt.md",
          "transcript_path": "examples/evaluations/hardness-v4/model-runs/codex-cli-default/ambiguity-disabled-status/weak/r03-output.md",
          "artifact_root": "examples/evaluations/hardness-v4/model-runs/codex-cli-default/ambiguity-disabled-status/weak/r03-artifacts",
          "artifact_paths": [
            "examples/evaluations/hardness-v4/model-runs/codex-cli-default/ambiguity-disabled-status/weak/r03-artifacts/account_status.py"
          ],